{
  "$schema": "https://json-schema.org/draft/2020-12/schema",
  "title": "Brief",
  "description": "Uppdraget för en kund med egen design: vem kunden är, vad sajten ska åstadkomma och hur den ska kännas. Skrivs före designen och ändras bara när kunden ändrar uppdraget. Ligger i kunder/<kund>/brief.json och kontrolleras av fabrik.py validera och bygg.",
  "type": "object",
  "required": ["kund", "verksamhet", "malgrupp", "mal", "kansla", "maste", "fakta"],
  "additionalProperties": false,
  "properties": {
    "kund": {
      "type": "string",
      "pattern": "^[a-z0-9]+(-[a-z0-9]+)*$",
      "formatText": "är kundens mapp i kunder/, till exempel cybernoodle",
      "description": "Kundens mapp i kunder/."
    },
    "verksamhet": {
      "type": "string",
      "minLength": 40,
      "description": "Vad kunden gör, var och för vem, med kundens egna ord. Det som gör dem olika andra."
    },
    "malgrupp": {
      "type": "string",
      "minLength": 20,
      "description": "Vilka som besöker sajten och vad de vill göra där, till exempel 'par och kompisgäng 25-40 som letar middag i kväll, nästan alltid i mobilen'."
    },
    "mal": {
      "type": "array",
      "minItems": 1,
      "items": { "type": "string", "minLength": 5 },
      "description": "Vad sajten ska åstadkomma, viktigast först, till exempel 'besökaren bokar bord i kväll'."
    },
    "kansla": {
      "type": "array",
      "minItems": 2,
      "items": { "type": "string", "minLength": 2 },
      "description": "Ord för känslan, och gärna vad den inte ska vara, till exempel 'nattlig', 'elegant', 'inte skrikig'."
    },
    "maste": {
      "type": "array",
      "items": { "type": "string", "minLength": 3 },
      "description": "Det som måste finnas på sajten, till exempel 'menyn som riktig text', 'bokning', 'menyfilter'."
    },
    "inte": {
      "type": "array",
      "items": { "type": "string", "minLength": 3 },
      "description": "Det kunden inte vill ha."
    },
    "referenser": {
      "type": "array",
      "items": { "type": "string", "minLength": 3 },
      "description": "Exempel i examples/ (mappens namn) eller adresser som visar nivån eller känslan kunden vill ha."
    },
    "fakta": {
      "enum": ["riktiga", "koncept"],
      "description": "riktiga: en riktig kund, och inget på sajten får vara påhittat. koncept: ett påhittat företag som HJERDAL visar upp, märkt Koncept."
    },
    "anteckningar": {
      "type": "string",
      "description": "Det som inte passar någon annanstans."
    }
  }
}
